id,datetime,tweets,edited,sentiment_intensity,sentiment,Anger,Anticipation,Disgust,Fear,Joy,Sadness,Surprise,Trust
6595397113,2009-12-12 09:16:15+00:00,"@DanaProtasova Well, do you love the countryside or the city there? I see beautiful waterfall in ur photo. Is it the SPIRIT of India U love?",danaprotasova well love countryside city see beautiful waterfall ur photo spirit india u love,0.9442,Positive,0,0,0,0,2,0,0,0
6572714235,2009-12-11 17:21:34+00:00,@kaypros ..hey Kay!!....will be in the Niagara on the Lake Santa parade tomorrow!!....driving one of our City of Waterfalls cars!!,kaypros hey kay niagara lake santa parade tomorrow drive city waterfall car,0.0,Neutral,0,1,0,0,0,0,0,0
6562162134,2009-12-11 09:36:29+00:00,December Fog in London. Very atmospheric walking through the City this morning. Happy Friday all.,december fog london atmospheric walking city morning happy friday,0.5719,Positive,0,1,0,0,0,0,0,0
6504938548,2009-12-09 18:52:50+00:00,@brundle_fly - the sun always shines over the City of Waterfalls!,sun always shin city waterfall,0.0,Neutral,0,1,0,0,1,0,1,1
6471501073,2009-12-08 18:52:07+00:00,@shawnlewis mlore is known only for its temples beaches and churches... Outskirts of city there are islands waterfalls scenic spots etc etc,shawnlewis mlore know temple beach church outskirt city island waterfall scenic spot etc etc,0.0,Neutral,0,1,0,0,2,0,0,1
6460836067,2009-12-08 11:14:39+00:00,"@holymully friends and family.Enjoy the trip and if you want to get to know Passa 4,a beautiful city,full of waterfalls and hills and trails",holymully friend family.enjoy trip want get know passa beautiful city full waterfall hill trail,0.8126,Positive,0,0,0,0,1,0,1,1
6388197384,2009-12-06 02:46:48+00:00,"http://bit.ly/ornki EMERALD HILLS!  ULTIMATE RESORT YARD W/POOL, SPA, WATERFALL & CABA (redwood city) $2695000:   S... http://bit.ly/5iKFFn",emerald hill ultimate resort yard spa waterfall caba redwood city,0.0,Neutral,0,1,0,0,1,0,1,1
6290213324,2009-12-03 02:25:51+00:00,"@brundle_fly are you saying that Hamilton is for lovers? Hamilton, city of waterfalls? You left ur heart in Hamilton? blahblahblah Hamilton?",brundle_fly say hamilton lover hamilton city waterfall leave ur heart hamilton blahblahblah hamilton,0.5574,Positive,0,1,0,0,1,0,0,1
6213520402,2009-11-30 21:40:33+00:00,I love Bermuda. RT @brundle_fly: I'm back in Hamilton! A city with some waterfalls. In Hamilton I gots it all...,love bermuda rt brundle_fly back hamilton city waterfall hamilton gots,0.6369,Positive,0,0,0,0,1,0,0,0
6187303454,2009-11-30 01:50:49+00:00,"HOLD UP, HOLD UP, HOLD UP!!! MODEL CITY???? UMMMMM CENTRIC??? SPLSH FUCKING WATERFALLS....I FEEL HOLLOW!!!!",hold hold hold model city ummmmm centric splsh fucking waterfall feel hollow,0.0,Neutral,0,0,0,0,0,1,0,0
6134070274,2009-11-28 05:23:49+00:00,i wanna go to see d twins waterfall on Singaraja city. Hmmm....,wan na go see twin waterfall singaraja city hmmm,0.0,Neutral,0,0,0,1,0,1,0,0
6036812601,2009-11-25 01:53:07+00:00,"RT @dtboyd: Just had a fun and enlightening call with CNN, ET(@mostew ) and Waterfall Mobile. Great panel shaping up for EIS in Park City.",rt dtboyd fun enlighten call cnn et mostew waterfall mobile great panel shape eis park city,0.8934,Positive,0,1,0,0,2,0,0,1
6021822340,2009-11-24 22:45:39+00:00,"Just had a really fun and enlightening call with CNN, ET(@mostew ) and Waterfall Mobile. Great panel shaping up for EIS in Park City.",really fun enlighten call cnn et mostew waterfall mobile great panel shape eis park city,0.9056,Positive,0,1,0,0,2,0,0,1
5973728288,2009-11-23 11:11:48+00:00,"City living. New project located in North Pattaya,refreshing design at very reasonable prices, pools,waterfall, garden. http://bit.ly/6sUd4e",city living new project locate north pattaya refresh design reasonable price pool waterfall garden,0.0,Neutral,0,0,0,0,1,0,0,0
5957403755,2009-11-22 22:19:09+00:00,"@MichelSavoie That ""City of Waterfalls"" ditty has forever ruined any and all reference to Hamilton's waterfalls for me.",michelsavoie city waterfall ditty forever ruin reference hamilton waterfall,-0.5859,Negative,0,0,0,1,0,1,0,0
5856034652,2009-11-19 12:27:38+00:00,"@daynoir So far absolutely. Pretty little city right on the sea. Just booked a trip to see the waterfalls, gesir and Blue Lagoon. Excited!",daynoir far absolutely pretty little city right sea book trip see waterfall gesir blue lagoon excite,0.7645,Positive,0,0,0,0,0,1,1,0
5786838211,2009-11-17 04:14:13+00:00,@brundle_fly - I'm not falling for that CIty of Waterfalls video... again... for the fourth time... ooh Bon Jovi,fall city waterfall video fourth time ooh bon jovi,0.0,Neutral,0,1,0,0,0,1,0,0
5729218612,2009-11-15 05:22:15+00:00,Facing Bluff Park Over Looking Waterfalls in Oregon City Sweet (Promanade Park) $625 1bd http://is.gd/4VieK,face bluff park looking waterfall oregon city sweet promanade park,0.4588,Positive,0,1,0,0,1,0,1,1
5671355306,2009-11-13 04:48:44+00:00,"Im off to Iligan City tomorrow if my deal pushes through c"", is there anybody from the city of waterfalls here?",im iligan city tomorrow deal push c anybody city waterfall,0.0,Neutral,0,2,0,0,1,0,1,1
5664641200,2009-11-13 00:15:57+00:00,Great!  RT @Billboarddotcom: Owl City regains the No.1 spot on the Hot 100 w/ Fireflies. http://bit.ly/eQOwj,great rt billboarddotcom owl city regain no.1 spot hot firefly,0.6249,Positive,1,0,0,0,0,0,0,0
5656953630,2009-11-12 19:14:54+00:00,"More London IT Jobs&gt; Development Manager- Waterfalls- London: £45000 - £60000 per annum:

City of London:
This is... http://bit.ly/3D0WmW",london job gt development london annum city london,0.2732,Positive,0,1,0,0,0,0,0,0
5655745528,2009-11-12 18:23:44+00:00,"Development Manager- Waterfalls- London: 
£45000 - £60000 per annum:

City of London:
This is a fantastic new o.. http://bit.ly/1C6bNJ",development london annum city london fantastic new,0.5574,Positive,0,1,0,0,0,0,0,0
5480239817,2009-11-06 15:00:37+00:00,"Register for the Water Bucket Walk at our booths at Dubai Mall (Waterfall area, GF) and Festival City (IKEA area, GF) tomorrow!",register water bucket walk booth dubai mall waterfall area gf festival city ikea area gf tomorrow,0.4939,Positive,0,1,0,0,0,0,0,0
5409569064,2009-11-04 02:30:55+00:00,@brundle_fly Now you are really making me feel bad...  ;)  Throw a welcome to Hamilton party!  (The City of Waterfalls)  http://bit.ly/bqsSs,brundle_fly really make feel bad throw welcome hamilton party city waterfall,0.235,Positive,1,0,1,1,0,1,0,0
5341268702,2009-11-01 17:11:22+00:00,London City Airport is amazing. 30 mins ago I was at Waterfall's flat watching F1 and drinking red wine. Now I'm waiting by the gate.,london city airport amazing min waterfall flat watching f1 drinking red wine wait gate,0.5859,Positive,0,3,0,1,0,0,0,1
5334579222,2009-11-01 09:28:58+00:00,"Jamaica is one of the nicest island in the Carribean. It has farmland, ranches, beaches, rivers, mountains and waterfalls. City: Kingston.",jamaica nice island carribean farmland ranch beach river mountain waterfall city kingston,0.4215,Positive,0,1,0,0,1,0,0,0
5269785347,2009-10-29 21:32:16+00:00,This week's No.1 on the Billboard Hot 100 is.... Fireflies by Owl City.  Check this video out:  http://bit.ly/fd9fp,week no.1 billboard hot firefly owl city check video,0.0,Neutral,1,0,0,0,0,0,0,0
5264525482,2009-10-29 17:43:51+00:00,Trippy audio art installation at San Francisco City hall involving bird chirping waterfalls echos http://twitpic.com/nemmf,trippy audio art installation san francisco city hall involve bird chirp waterfall echos,0.0,Neutral,0,1,0,0,2,1,1,0
5259637251,2009-10-29 14:18:59+00:00,Congrats! RT @Billboarddotcom: It's chart day and this week's No.1 on the Hot 100 is.... Fireflies by Owl City. http://bit.ly/yCwKq,congrats rt billboarddotcom chart day week no.1 hot firefly owl city,0.5267,Positive,1,0,0,0,0,0,0,1
5174527295,2009-10-26 14:54:42+00:00,RT @cityofwaterfall the City of Waterfalls booth is at the Hamilton Mum Show! Drop by for a visit!!,rt cityofwaterfall city waterfall booth hamilton mum show drop visit,-0.2732,Negative,0,0,0,1,0,0,0,1
5151565680,2009-10-25 17:46:44+00:00,"@Mariia10 pictures of the mountains, waterfalls, sculptures & random shoots of the city, downtown area. What do you like about Michigan?",mariia10 picture mountain waterfall sculpture random shoot city downtown area michigan,-0.34,Negative,1,1,0,1,0,0,0,0
5104815207,2009-10-23 19:32:29+00:00,http://twitpic.com/mmmcv - At kettlemen city eating subway!! Yer sang waterfalls in the car wid Missy Laura Jackie and ate Eileen! So dope!,kettlemen city eat subway yer sing waterfall car wid missy laura jackie eat eileen dope,0.0,Neutral,0,1,0,0,1,1,0,1
5095497621,2009-10-23 12:34:52+00:00,"@ENBdavies - ""City of Waterfalls"" moniker is really losing traction, I heard Mayor Fred say ""City of Entrepreneurs"" yesterday, which is nice",enbdavies city waterfall moniker really losing traction hear mayor fred say city entrepreneur yesterday nice,-0.024,Neutral,1,0,1,1,0,1,1,0
5086283551,2009-10-23 02:06:01+00:00,"I hope it's the Curse of the Waterfall Guy for the Double City Bandits, @cvvalencia #yanks #mlb",hope curse waterfall guy double city bandit cvvalencia yank mlb,-0.1531,Negative,0,1,0,0,1,0,1,1
4942237078,2009-10-17 13:54:37+00:00,Taking north coast bus along river from Quebec City to The Fairmont in Richelieu. Fall color peaked but still beautiful & waterfalls! #ATWS,take north coast bus river quebec city fairmont richelieu fall color peak still beautiful waterfalls atws,0.5994,Positive,0,0,0,0,0,1,0,0
4877625811,2009-10-15 01:30:38+00:00,"Bright, blue skies. Warm, tropical day. Fears about the weather were unfounded. Will go on a city tour in 30mins. Cascades waterfall 2mrw.",bright blue sky warm tropical day fear weather unfounded go city tour cascade waterfall,0.1531,Positive,1,0,0,1,0,1,0,0
4781640881,2009-10-11 10:07:20+00:00,"P888 TIP: Visit hot springs, caves and waterfalls in Samar's first class city, Calbayog! Promo seats still available 1st wk of Nov. Hurry!",p888 tip visit hot spring cave waterfall samar first class city calbayog promo seat still available wk nov hurry,0.0,Neutral,1,0,0,0,0,0,0,0
4772008327,2009-10-10 23:52:35+00:00,#mango juice #IncaKola #rum & number 56 ring #Peruvian #cigars.  #Tarapoto the high #jungle city is beautiful this time of year  #waterfalls,mango juice incakola rum number ring peruvian cigar high jungle city beautiful time year waterfall,0.6369,Positive,0,1,0,0,0,0,0,0
4758500839,2009-10-10 11:07:21+00:00,HI U GUYS I HOPE U ARE FINE,hi u guy hope fine,0.5719,Positive,0,1,0,0,1,0,1,1
4723526138,2009-10-09 01:51:09+00:00,@cloes509 Noo... the river is past hehe.... to several mounts and hills and waterfalls and historical cities and shit... =),cloes509 noo river past hehe several mount hill waterfall historical city shit,-0.5574,Negative,1,0,1,0,0,0,0,0
4639645303,2009-10-05 22:35:46+00:00,RT @Tshelt13Broncos: Shout out to the Pink Waterfall ;) &lt;- I saw that in center city earlier,rt tshelt13broncos shout pink waterfall lt saw center city earlier,0.0,Neutral,1,0,0,0,0,0,1,1
4581319832,2009-10-03 15:59:41+00:00,"Paul McCartney will release ""Good Evening New York City"" in Japan on November 11, in the US on November 17 and in the UK on November 23.",paul mccartney release good evening new york city japan november u november uk november,0.4404,Positive,0,1,0,0,1,0,1,1
4563030030,2009-10-02 20:58:29+00:00,@kollagegotcha omg i love Portland. make sure you get a Voodoo donut while you're there. And get out of the city and see the waterfalls!,kollagegotcha omg love portland make sure get voodoo donut get city see waterfall,0.7579,Positive,0,0,0,0,1,0,0,0
4555536260,2009-10-02 15:45:32+00:00,OMG!  RT @WSJ: BREAKING NEWS: Chicago and Tokyo have been eliminated in voting to select the host city for the 2016 Olympics. Rio and Mad..,omg rt wsj breaking news chicago tokyo eliminate vote select host city olympics rio mad,-0.4939,Negative,2,1,1,1,1,2,2,1
4450203528,2009-09-28 19:16:20+00:00,"Leaving Dubai. Jawdropping city. Indoor skiing, world's tallest bldng/ indoor waterfall. The people: hospitable & honorable. Tomorrow Paris",leave dubai jawdropping city indoor skiing world tall indoor waterfall people hospitable honorable tomorrow paris,0.5106,Positive,0,1,0,0,0,0,0,1
4447602012,2009-09-28 17:20:08+00:00,"Top 10 Cities for New Jobs - basically if you have a waterfall in town, you've got a shot at making this list. http://ow.ly/rs34",top city new job basically waterfall town get shot make list,0.2023,Positive,1,1,0,1,0,1,1,1
4443049541,2009-09-28 13:58:19+00:00,Owl City album is ruining my ability to be a cynical bastard. Feel like I am in a waterfall shower of my little ponies. And I LIKE IT!,owl city album ruin ability cynical bastard feel waterfall shower little pony like,-0.749,Negative,0,0,1,1,0,2,0,0
4439637463,2009-09-28 10:21:31+00:00,"OZRIC TENTACLES Waterfall Cities music review by Prog Leviathan: Still, the Ozrics are so good that there are a.. http://bit.ly/hX65Y",ozric tentacle waterfall city music review prog leviathan still ozrics good,0.4404,Positive,0,1,0,0,2,1,1,1
4435614554,2009-09-28 04:58:56+00:00,OZRIC TENTACLES Waterfall Cities music review by Prog Leviathan http://bit.ly/3Dn6iW,ozric tentacle waterfall city music review prog leviathan,0.0,Neutral,0,0,0,0,1,1,0,0
4414062307,2009-09-27 09:37:32+00:00,"filming at Waterfall studios oipposite BBC white city. it is a beautiful day and we are in a studio, yuck!",film waterfall studio oipposite bbc white city beautiful day studio yuck,0.5994,Positive,0,1,0,0,1,0,0,1
4412153406,2009-09-27 06:39:51+00:00,@JulietteSwan15 Oh thats right...which city u in? Next time I go there I wanna go the waterfalls,julietteswan15 oh thats right city u next time go wan na go waterfall,0.0,Neutral,0,1,0,1,0,1,0,0
4406704395,2009-09-27 01:24:11+00:00,City Garden night shot in front of the waterfall.   http://twitpic.com/jams7,city garden night shot front waterfall,0.0,Neutral,1,0,0,1,1,1,1,0
4398482385,2009-09-26 18:04:19+00:00,Trip to Hamilton cancelled. I guess I'll have to see the City of Waterfalls (and McMaster) another day. Substituting with coffee at Aroma.,trip hamilton cancel guess see city waterfall mcmaster day substitute coffee aroma,-0.25,Negative,0,0,0,0,0,1,2,0
4393348583,2009-09-26 13:35:04+00:00,"At Deep Creek, the Bryson City enterence to the Great Smokies Park find camping, picnicing, and a hiking trail past 3 waterfalls.",deep creek bryson city enterence great smokies park find camping picnicing hiking trail waterfall,0.6249,Positive,0,1,0,0,1,0,1,1
4393084481,2009-09-26 13:16:26+00:00,"Darn, gonna to miss Nuit Blanche this year... Had soooo much fun last year...that waterfall, pong on city hall ! #golfinwiththeboys",darn gon miss nuit blanche year soooo much fun last year waterfall pong city hall golfinwiththeboys,0.4019,Positive,0,1,0,0,1,0,0,0
4356720069,2009-09-25 01:09:33+00:00,"My goals for tomorrow include Waterfall Quest, Tree Gnome Village, Lost City, idk after that depends how much I play.  Pandora rly helps ...",goal tomorrow include waterfall quest tree gnome village lost city idk depend much play pandora rly help,0.34,Positive,2,4,2,1,1,1,1,2
4310842026,2009-09-23 07:46:31+00:00,"Wow. Granite City Public Access really is hip with the times. The soundtrack to our current events? ""Don't Go Chasin' Waterfalls""",wow granite city public access really hip time soundtrack current event n't go chasin waterfall,0.5859,Positive,0,2,0,0,0,0,0,0
4304270965,2009-09-23 01:34:27+00:00,Valdez is like the waterfall capital of the world! If global warning ever kicks in this city will have quite the show! :),valdez waterfall capital world global warning ever kick city quite show,-0.34,Negative,1,1,0,1,0,0,1,2
4168362671,2009-09-22 08:56:39+00:00,Juz got back from #Halo #ODST launch with @Insidegaming at City Walk. So very sad. Next time I want exploding babies and vodka waterfalls!!!,juz get back halo odst launch insidegaming city walk sad next time want explode baby vodka waterfall,-0.4215,Negative,0,2,0,0,0,0,0,0
4154914337,2009-09-21 20:38:15+00:00,"I favorited a YouTube video -- Waterfall Reverse Gravity Bong Clip from ""The KIND City"" A movie by The ... http://bit.ly/1PWp0W",favorited youtube video waterfall reverse gravity bong clip kind city movie,0.7269,Positive,0,0,0,0,1,0,0,1
4104717411,2009-09-19 16:09:42+00:00,Back through all the lava fields and waterfalls into the city for a runtur!,back lava field waterfall city runtur,0.0,Neutral,1,0,0,1,0,0,0,0
4063851262,2009-09-17 21:40:12+00:00,"The actress I visited #Niagara with and who did the videos, is a city girl, but she was struck with awe by the waterfalls and park",actress visit niagara video city girl strike awe waterfall park,-0.128,Negative,1,0,0,0,0,0,0,0
3893653698,2009-09-10 19:03:31+00:00,Selangor is endow with verdant forest reserves scenic waterfalls and fascinating wetlands. Outdoor activities within easy reach of the city,selangor endow verdant forest reserve scenic waterfall fascinate wetland outdoor activity easy reach city,0.7506,Positive,0,0,0,0,0,0,0,1
3882320611,2009-09-10 06:14:03+00:00,@KansasTravel There is another waterfall in Kansas City off Cliff Drive. Info:  http://bit.ly/Mczr3,kansastravel waterfall kansa city cliff drive info,0.0,Neutral,0,0,0,1,0,0,0,0
3872539005,2009-09-09 21:53:10+00:00,"Just started reading Into the Wild. As a city person who enjoys the occasional hike if a pretty waterfall's involved, it's mostly baffling.",start read wild city person enjoy occasional hike pretty waterfall involve mostly baffling,0.7506,Positive,0,2,0,0,1,0,1,1
3852310595,2009-09-09 00:23:00+00:00,"My new goal in life is to have a cake made by Charm City Cakes. My head on a mermaid body, on top of a magnificent waterfall.",new goal life cake make charm city cake head mermaid body top magnificent waterfall,0.8126,Positive,0,1,0,0,0,0,0,1
3814829030,2009-09-07 07:39:10+00:00,"marijuana kush caregiver: Waterfall Reverse Gravity Bong Clip from ""The KIND City... http://bit.ly/2PoQa1",marijuana kush caregiver waterfall reverse gravity bong clip kind city,0.5267,Positive,0,0,0,0,1,0,0,1
3785587806,2009-09-05 20:57:51+00:00,"thank you argentina for your exquisite waterfall and city, and making this trip worth it! next time i'll make sure to visit patagonia too.",thank argentina exquisite waterfall city make trip next time make sure visit patagonia,0.5859,Positive,0,1,0,0,0,0,1,0
3765880845,2009-09-04 21:31:29+00:00,I found a waterfall garden in the midst of a big city. Oh Seattle. You are lovely.,find waterfall garden midst big city seattle lovely,0.5859,Positive,0,0,0,0,2,0,0,0
3759293367,2009-09-04 15:51:28+00:00,Sitting by the lilly pond listening to the nearby waterfall and the noise of the distant city.  I love this place!,sit lilly pond listening nearby waterfall noise distant city love place,0.6369,Positive,0,0,0,0,1,0,0,0
3743092666,2009-09-03 22:01:53+00:00,"Yoga should be mandatory in schools in those stressful cities....Squeezy Balls, Mini Waterfalls in classrooms...something...",yoga mandatory school stressful city squeezy ball mini waterfall classroom something,-0.4588,Negative,0,0,0,0,0,0,0,1
3612585738,2009-08-28 22:12:24+00:00,This was the backdrop of our community event...guy said  it is the only waterfall in the center of a city in the worl http://mypict.me/sR2n,backdrop community event guy say waterfall center city worl,0.0,Neutral,0,0,0,0,0,0,0,1
3598996435,2009-08-28 08:28:02+00:00,RT @Maddog9000 - Driving our scooters out of the steamy city to find our own private waterfall in the hidden interior of Taiwan.,rt maddog9000 drive scooter steamy city find private waterfall hidden interior taiwan,0.0,Neutral,0,0,1,0,0,0,0,1
3598876061,2009-08-28 08:15:20+00:00,@Destination140 Driving our scooters out of the steamy city to find our own private waterfall in the hidden interior of Taiwan.,destination140 driving scooter steamy city find private waterfall hidden interior taiwan,0.0,Neutral,0,0,1,0,0,0,0,1
3556493116,2009-08-26 13:53:15+00:00,Just a few more weeks to enjoy tubing here in Bryson City before it will be too cold for the hardiest of us! Waterfalls are awesome now!,week enjoy tube bryson city cold hardiest waterfall awesome,0.8074,Positive,0,1,0,0,1,0,0,1
3547431111,2009-08-26 01:33:08+00:00,Enjoyed a great hike to two new Hamilton waterfalls along the Bruce Trail. It's great to live in a city with so much variety so close.,enjoy great hike new hamilton waterfalls bruce trail great live city much variety close,0.9081,Positive,0,1,0,0,1,0,0,1
3533171690,2009-08-25 11:42:55+00:00,"yeah i go on saturday to P&B in Hamburg City, we looking for flowers and waterfalls for our garden. let the time roll",yeah go saturday p b hamburg city look flower waterfall garden let time roll,0.296,Positive,0,1,0,0,1,0,0,0
3524997282,2009-08-25 01:17:20+00:00,"Daily Planet, Bloomingdales, Roosevelt cable car, Naked Cowboy, Mets game and my first Cosmopolitan in NYC by a waterfall. Love this city.",daily planet bloomingdales roosevelt cable car naked cowboy mets game first cosmopolitan nyc waterfall love city,0.6369,Positive,0,0,0,0,1,0,0,1
3427003372,2009-08-20 13:10:26+00:00,"ok, time to clean up for the night. off to the shower - AGAIN. in this weather, if only we had public waterfalls in the city!",ok time clean night shower weather public waterfall city,0.5994,Positive,0,2,0,0,1,0,0,1
3391311715,2009-08-18 21:40:25+00:00,"Arrived in Zadar. Lovely hotel by the water. Almost relieved not to stay in old city tonight. Today: coastal driving, gorgeous waterfalls!",arrive zadar lovely hotel water almost relieve stay old city tonight today coastal driving gorgeous waterfall,0.8752,Positive,0,0,0,0,2,0,0,0
3391275824,2009-08-18 21:38:28+00:00,We were looking for waterfalls but we got lost & the local city people saw us and offered to take us #fb http://yfrog.com/5dm5hj,look waterfall get lose local city people saw offer take fb,-0.4019,Negative,1,0,1,1,0,1,1,0
3354937508,2009-08-17 03:02:42+00:00,Finding a secret waterfall in the middle of the city = amazing. :o),find secret waterfall middle city amazing,0.5859,Positive,0,0,0,0,0,0,0,1
3345913814,2009-08-16 16:15:25+00:00,"Leaving the peace of Mount Shasta behind, back to the city...good bye log cabin, sauna & nearby waterfalls hello laptop & starbucks ;-)",leave peace mount shasta back city good bye log cabin sauna nearby waterfall hello laptop starbucks,0.7351,Positive,0,2,0,0,1,0,1,1
3333457905,2009-08-15 20:42:24+00:00,On the way to the top of the waterfall just outside of Quebec City. - http://twitpic.com/e11rx http://bit.ly/mSfSZ,way top waterfall quebec city,0.2023,Positive,0,1,0,0,0,0,0,1
3316105789,2009-08-14 21:32:42+00:00,It's lovely stumbling upon a rather large waterfall in the middle of a city.  http://twitvid.com/A7C62,lovely stumbling rather large waterfall middle city,0.5859,Positive,0,0,0,0,1,0,0,0
3311879551,2009-08-14 17:43:08+00:00,finished picnic at City Garden with Laura and Ella.  Ella loves the waterfall and fountains.,finish picnic city garden laura ella ella love waterfall fountain,0.6369,Positive,0,1,0,0,3,0,1,1
3231812245,2009-08-10 20:38:58+00:00,"@brundle_fly I was expecting a link to Hamilton, City of Waterfalls in that breaking news.",brundle_fly expect link hamilton city waterfall break news,0.0,Neutral,0,1,0,0,0,0,2,1
3231227018,2009-08-10 20:06:28+00:00,"This is why I LOVE Rochester, NY...how many cities have a waterfall in the middle of the city?!  http://twitpic.com/dfagi",love rochester ny many city waterfall middle city,0.6369,Positive,0,0,0,0,1,0,0,0
3227464349,2009-08-10 16:21:41+00:00,Brazil Favorites #11 = Driving an hour out of the city and spending a day at the waterfalls with my friends! Photo = http://bit.ly/MdlJT,brazil favorite drive hour city spend day waterfall friend photo,0.7351,Positive,0,0,0,0,1,0,0,1
3203186403,2009-08-09 05:24:41+00:00,We may gave jammed to the city of waterfalls song for far too long tonight in our drunken stoopers #hamilton,give jam city waterfall song far long tonight drunken stooper hamilton,0.0,Neutral,0,1,1,0,0,0,0,0
3196947982,2009-08-08 19:52:25+00:00,"Little cold this morning, but now on the train at waterfall heading to the city. Shellharbour is sometmes so far from the action!",little cold morning train waterfall head city shellharbour sometmes far action,0.0,Neutral,0,1,0,0,0,0,0,0
3183144024,2009-08-07 20:43:40+00:00,@brundle_fly Damn you and your City of Waterfalls video!!! Got me twice now! Haha... grrr,brundle_fly damn city waterfall video got twice haha grrr,-0.0258,Neutral,1,0,1,0,0,0,0,0
3182817719,2009-08-07 20:20:14+00:00,"The horrid City of Waterfalls jingle is now stuck in my head. Thanks, @chriskayTO @ZoeSasha. Not to mention I'm writing a report on Hamilton",horrid city waterfall jingle stick head thanks chriskayto zoesasha mention write report hamilton,-0.1531,Negative,1,0,1,1,0,1,0,0
3182382832,2009-08-07 19:47:42+00:00,"@brundle_fly - damn man, i've been Hammered... *sings CIty of Waterfalls*",damn man hammered sings city waterfall,-0.4019,Negative,1,1,1,0,1,1,0,1
3168904350,2009-08-06 20:32:29+00:00,"@OOAJoe, um there's bike paths around by me, one goes through waterfall glenn which is fun, i wanna bike in the city soon.",ooajoe bike path go waterfall glenn fun wan bike city soon,0.5106,Positive,0,1,0,1,1,1,0,0
3144573995,2009-08-05 12:52:38+00:00,"rt @nycgo Day Trips: Waterfalls, historic mansions and antiques are all just a short drive from the City. http://bit.ly/mmtEP",rt nycgo day trip waterfall historic mansion antique short drive city,0.0,Neutral,0,0,0,0,0,0,1,0
3126346171,2009-08-04 15:52:54+00:00,"RT @nycgoDay Trips: Waterfalls, historic mansions and antiques are all just a short drive from the City. http://bit.ly/mmtEP",rt nycgoday trip waterfall historic mansion antique short drive city,0.0,Neutral,0,0,0,0,0,0,1,0
