id,datetime,username,tweets,edited,sentiment_intensity,sentiment,Anger,Anticipation,Disgust,Fear,Joy,Sadness,Surprise,Trust
958623480433512451,2018-01-31 08:50:22+00:00,nanacwamegh,"@benkoku if you have ever chanced on the plan for the proposed HOPE CITY PROJECT which never came to light errr, u will understand how Ghana we think. #CitiCBS",benkoku ever chance plan propose hope city project never come light errr u understand ghana think citicbs,0.5994,Positive,0,2,0,0,1,0,1,1
933783935212978176,2017-11-23 19:46:53+00:00,RohLollipop,"Gostei de um vídeo @YouTube https://t.co/TvvtLSL931 Brown - ""Smoking Weed Act"" at Hope City Concert in Accra, Ghana |",gostei brown smoking weed act hope city concert accra ghana,0.4404,Positive,0,1,0,0,1,0,1,1
915819128216326144,2017-10-05 06:01:09+00:00,WikipediaBits,"Dunkonaa is suburb of Accra in Ghana. The town is the site of Hope City, a technology park in Ghana.",dunkonaa suburb accra ghana town site hope city technology park ghana,0.4404,Positive,0,1,0,0,1,0,1,1
889440200815988741,2017-07-24 11:00:43+00:00,TechNovaGh,Mauritius Wants To Help Build A Cyber City In Ghana. Another Hope City Story In The Making? https://t.co/DXSv2uQoWu #HopeCity #Accra https://t.co/gJk6kg8kZn,mauritius want help build cyber city ghana hope city story making hopecity accra,0.7096,Positive,0,1,0,0,1,0,1,1
879988016797945857,2017-06-28 09:01:07+00:00,TechNovaGh,Mauritius Wants To Help Build A Cyber City In Ghana. Another Hope City Story In The Making? https://t.co/zRH8E8AuIC https://t.co/DVTHGkvVMl,mauritius want help build cyber city ghana hope city story making,0.7096,Positive,0,1,0,0,1,0,1,1
878193050555568132,2017-06-23 10:08:33+00:00,AllfactsAfrican,"Hope City, Ghana...Hope being an acronym for Home, Office, People , Environment.... another… https://t.co/Elm5cXLpzk",hope city ghana hope acronym home office people environment another…,0.7003,Positive,0,2,0,0,2,0,2,2
871633012466880512,2017-06-05 07:41:18+00:00,rockyamartey,@NiiDarku @KafuiDey The question is that is Ghana even ready for a project like the hope City?,niidarku kafuidey question ghana even ready project hope city,0.6597,Positive,0,1,0,0,1,0,1,1
868927643000950792,2017-05-28 20:31:08+00:00,fleapius,Lowered expectations for Ghana's Hope City? via @AJAM  https://t.co/BQeHkhwUDo,lower expectation ghana hope city ajam,0.1779,Positive,0,2,0,0,1,1,2,2
868604700618362880,2017-05-27 23:07:53+00:00,PJquaye,"Lowered expectations for Ghana's Hope City? via @AJAM  https://t.co/4emEkjliRi

A cautionary tale of all talk and not feasibility studies.",lower expectation ghana hope city ajam cautionary tale talk feasibility study,0.1779,Positive,0,2,0,0,1,1,2,2
868077794152108033,2017-05-26 12:14:08+00:00,valanchee,"17. Even when govts are excited to help. They often don't know how to: E.g Konza city in Kenya, Tinapa in Nigeria, Hope city in Ghana.",even govts excite help often n't know e.g konza city kenya tinapa nigeria hope city ghana,0.8271,Positive,0,1,0,0,1,0,1,1
866548396072501248,2017-05-22 06:56:51+00:00,TruehiveAcademy,What Happened To Hope City Ghana ?  @JDMahama  @NAkufoAddo @MBawumia,happen hope city ghana jdmahama nakufoaddo mbawumia,0.4404,Positive,0,2,0,0,1,0,1,1
843350118476763136,2017-03-19 06:35:11+00:00,kingnanakwasi,"Chris Brown was brought to Ghana to perform for the $1 billion Hope City project which was to provide over 7,000... https://t.co/0fAINF4JlQ",chris brown bring ghana perform hope city project provide,0.4404,Positive,0,1,0,0,1,0,1,1
842894515967016960,2017-03-18 00:24:47+00:00,___vaughan,@wuzz___ some city them dey build for Ghana. Hope city,wuzz___ city dey build ghana hope city,0.4404,Positive,0,1,0,0,1,0,1,1
838347454252740609,2017-03-05 11:16:23+00:00,yawasamoah2,Ghana's John Mahama launches Hope City project - BBC News https://t.co/gCW1l2zSEW,ghana john mahama launch hope city project bbc news,0.4404,Positive,0,2,1,0,1,0,1,1
831472132911566848,2017-02-14 11:56:19+00:00,news_ghana,Mahama’s Hope City In 2013 Was A False Prophecy https://t.co/2e6ZuAQw2k https://t.co/R2KMT9IC3I,mahama hope city wa false prophecy,0.4404,Positive,0,1,0,0,1,0,1,1
810087480888356865,2016-12-17 11:41:20+00:00,TwumTweets,"What happened to The Hope City Project? 1,000,000 dollars was paid to Chris Brown for the launch. Eeeeih Ghana 😂😂😂",happen hope city project dollar pay chris brown launch eeeeih ghana,0.3612,Positive,0,4,0,0,2,0,1,2
809300985160040448,2016-12-15 07:36:05+00:00,Birdsong1488,#citicbs @benkoku @RichardDelaSky @JustNanaAma @thenanaaba @KojoAB What happened to rlg and the Hope City??? Chris Brown et al. Eeiii Ghana!,citicbs benkoku richarddelasky justnanaama thenanaaba kojoab happen rlg hope city chris brown al eeiii ghana,0.4404,Positive,0,2,0,0,1,0,1,1
806086330899976192,2016-12-06 10:42:12+00:00,GreyFynn,That $40m you know. Hope City plus Chris Brown in Ghana https://t.co/5CMcE9hDC7,know hope city chris brown ghana,0.4404,Positive,0,1,0,0,1,0,1,1
794295610711150592,2016-11-03 21:50:05+00:00,djkobbie,What ever became of #Ghana's Hope City: 'Africa's tallest $10billion Tech hub building' !,ever become ghana hope city tall tech hub build,0.4404,Positive,0,1,0,0,1,0,1,1
789207015444873217,2016-10-20 20:49:49+00:00,BrytAgyekum,"Hmmmmmmm, i wanna know the current status of 'The Hope City Park' started by rlg ghana... https://t.co/yDguKd3aGL",hmmmmmmm wan na know current status hope city park start rlg ghana,0.4404,Positive,0,2,0,1,1,1,1,1
779712795814289409,2016-09-24 16:03:11+00:00,Calebhammnd,"Bringing greetings from Ghana at Mission of Hope (City of Refuge), Ojuku... #LastNight #MissionReport #SierraLeone",bring greeting ghana mission hope city refuge ojuku lastnight missionreport sierraleone,0.6705,Positive,0,1,0,0,1,0,1,1
779686998219063297,2016-09-24 14:20:40+00:00,PrayForGh,"Ghana is fast becoming Africa's model of ""Hope City"" bustling with life. @jeremycorbyn  @DeleMomodu @MBuhari #JMToaso #VoteJM2016 https://t.co/z5jn7z32PO",ghana fast become africa model hope city bustling life jeremycorbyn delemomodu mbuhari jmtoaso votejm2016,0.4404,Positive,0,1,0,0,1,0,1,1
776875691447095300,2016-09-16 20:09:33+00:00,EricksMcFc,@talkSPORTLive listening all the way from Ghana via Citi fm I still sense a chelsea come back.2-2 draw..Hope City win tommorow..,talksportlive listen way ghana citi fm still sense chelsea come draw hope city win tommorow,0.7717,Positive,0,1,0,0,1,0,1,1
770325181847965696,2016-08-29 18:20:09+00:00,simeoneos,What is the fate of the $10bn project? BBC News - Ghana's John Mahama launches Hope City project https://t.co/mmwgHzxyXg,fate project bbc news ghana john mahama launch hope city project,0.4404,Positive,0,3,1,0,1,0,1,1
753927247766192133,2016-07-15 12:20:37+00:00,robertdavid010,Hope city by @TonyJeanClaude #anthonyjeanclaude #ghana https://t.co/hNyl3lYI2J via @SlideShare,hope city tonyjeanclaude anthonyjeanclaude ghana slideshare,0.4404,Positive,0,1,0,0,1,0,1,1
751355866146832384,2016-07-08 10:02:52+00:00,rockyamartey,@myradio360 but the hope city dream should not die.  It's integral for Ghana development and urbanization of the new Accra,myradio360 hope city dream die integral ghana development urbanization new accra,0.0,Neutral,0,2,0,1,1,1,1,1
751128792039501824,2016-07-07 19:00:33+00:00,PulseGhana,"#PulseFeatures
Rejoinder: Why Pulse Ghana was wrong on HOPE City https://t.co/StMrBonDiH #PulseGhana https://t.co/VFylIa96rE",pulsefeatures rejoinder pulse ghana wrong hope city pulseghana,-0.0516,Negative,0,1,0,0,1,0,1,1
751017086017605632,2016-07-07 11:36:41+00:00,PulseGhana,Rejoinder: Why Pulse Ghana was wrong on HOPE City https://t.co/StMrBonDiH #PulseGhana https://t.co/VFylIa96rE,rejoinder pulse ghana wrong hope city pulseghana,-0.0516,Negative,0,1,0,0,1,0,1,1
751016697113575424,2016-07-07 11:35:08+00:00,Nyaba_Abu,Rejoinder: Why Pulse Ghana was wrong on HOPE City https://t.co/kItXH0yFjd https://t.co/ctXt1gsdh7,rejoinder pulse ghana wrong hope city,-0.0516,Negative,0,1,0,0,1,0,1,1
750695448378241024,2016-07-06 14:18:36+00:00,3cventuresltd,Why Pulse Ghana was wrong on HOPE City  https://t.co/RkKTEWObrd,pulse ghana wrong hope city,-0.0516,Negative,0,1,0,0,1,0,1,1
750282424546893824,2016-07-05 10:57:24+00:00,Nyaba_Abu,RLG’s Hope City joins Africa’s herd of white Elephant projects https://t.co/TRTnqI1Isn    #Feature #RLG #Ghana https://t.co/saWVfSrJE0,rlg hope city join africa herd white elephant project feature rlg ghana,0.6249,Positive,0,2,0,0,2,0,1,2
740246846027800576,2016-06-07 18:19:35+00:00,Nauja_Kleist,Will Ghana's Hope City join Africa's herd of white elephant projects? | Mark Tran https://t.co/RVDlkbr6NB #Ghana,ghana hope city join africa herd white elephant project mark tran ghana,0.6249,Positive,0,2,0,0,2,0,1,2
725940267165999104,2016-04-29 06:50:21+00:00,AfiIAm,"So whatever happened to the Hope City project?

Yeah that one...

What was supposed to be Silicon Valley of Ghana.",whatever happen hope city project suppose silicon valley ghana,0.4404,Positive,0,2,0,0,1,0,1,1
723847959998291969,2016-04-23 12:16:16+00:00,__KobbyTakyi,@talkSPORTLive i hope city will lose today.. From capecoast in Ghana.. Live on my fone tunein radio app,talksportlive hope city lose today capecoast ghana live fone tunein radio app,0.0516,Positive,1,1,1,1,1,1,2,1
709021931098513408,2016-03-13 14:22:56+00:00,askcyriaano,@davegilpin I will be dropping into the Accra branch of Hope City next time I am in Ghana,davegilpin drop accra branch hope city next time ghana,0.2023,Positive,0,2,0,0,1,0,1,1
707170842728341505,2016-03-08 11:47:22+00:00,gamelmag,"Rwanda to launch Kigali innovation city to bring tech, research, &amp; capital together - Paul Kagame #NEF2016. Ghana where is Hope city?",rwanda launch kigali innovation city bring tech research amp capital together paul kagame nef2016 ghana hope city,0.6705,Positive,0,2,0,0,1,0,1,1
702704306550661121,2016-02-25 03:58:56+00:00,AkwasiAkyereko,"Dear @BBCAfrica You informed us in Ghana that our President promised a Hope City in 2016? Its 3 years after promise

https://t.co/T4WBUVVazS",dear bbcafrica inform ghana president promise hope city year promise,0.8442,Positive,0,1,0,0,1,0,1,2
702291130302468097,2016-02-24 00:37:08+00:00,tnokobi,"Govt Of Ghana Scholarship Award Entrance Examination, 2016
Que 22. Where in Ghana can you find Hope City Tech... https://t.co/BFrjR8pvTi",govt ghana scholarship award entrance examination que ghana find hope city tech,0.7506,Positive,0,2,0,0,3,0,2,2
701104364329553920,2016-02-20 18:01:21+00:00,The_African_Way,Ghana’s $10 billion Futuristic Utopia. Hope City - “Many African cities will double in size over the next... https://t.co/QJHLgpOZMg,ghana futuristic utopia hope city many african city double size next,0.4404,Positive,0,1,0,0,1,0,1,1
701092728818552832,2016-02-20 17:15:06+00:00,GreatAbotu,watching Love Don't Cost a Thing at Hope City Ghana https://t.co/aT0BgobaiE,watch love n't cost thing hope city ghana,0.4203,Positive,0,2,0,1,2,0,1,1
692587038110007296,2016-01-28 05:56:32+00:00,sir_olamosh,"Where is RLG’s Boss, Roland Agambire? | Ghana’s $10billion HOPE CITY Dead? https://t.co/ispupGsIo9 #news",rlg bos roland agambire ghana hope city dead news,-0.34,Negative,0,1,0,0,1,0,1,1
692438198912471041,2016-01-27 20:05:06+00:00,belinsworld,Hope deflated for Ghana’s Hope City? https://t.co/OfZ5hoIjTf,hope deflate ghana hope city,0.7003,Positive,0,2,0,0,2,0,2,2
688368318273695745,2016-01-16 14:32:50+00:00,Ottisrabia_AFC,"@talkSPORTLive Listening to you live from Tamale Ghana, hope city and Leicester drops points and Arsenal triumph in their game tomorrow.",talksportlive listen live tamale ghana hope city leicester drop point arsenal triumph game tomorrow,0.5994,Positive,0,3,0,0,2,0,1,1
